mythicalCreature,mythicalCreatureLabel,mythicalCreatureDescription
http://www.wikidata.org/entity/Q15638692,Alfesibea,Nymphe der Griechischen Mythologie
http://www.wikidata.org/entity/Q6933700,Damon,fiktive Figur
http://www.wikidata.org/entity/Q1242355,Nysa,Nymphe der Griechischen Mythologie
http://www.wikidata.org/entity/Q99463925,Al Dschann,Stammvater der Dschinn
http://www.wikidata.org/entity/Q15783248,Anaxibia,von Apollon verfolgte Nymphe
http://www.wikidata.org/entity/Q55412668,Arcas,[2]
http://www.wikidata.org/entity/Q55423468,Arctophonvs,"ARCTOPHŎNVS , einer von den Hunden des Orions , Nat. Comes lib. VIII. c. 12 . welcher so viel als einer heißt, der Bäre erwürget und tödtet."
http://www.wikidata.org/entity/Q55457654,Arethvsa,[3]
http://www.wikidata.org/entity/Q55536085,Argo,[1]
http://www.wikidata.org/entity/Q55794533,Aslo,"ASLO , eines von den Pferden der Sonne, dessen Namen aber vermuthlich verderbt ist; wiewohl man ihn auch nicht zu verbessern weis. Hygin. Fab. 183. & ad eum Munck. l. c ."
http://www.wikidata.org/entity/Q750206,Astovidatu,Dämon aus der altiranischen Mythologie
http://www.wikidata.org/entity/Q55837842,Astylvs,"ASTYLVS , i , ( ⇒ Tab. XIV.) einer von den Centauren und zugleich auch ein guter Wahrsager, welcher den Seinigen die Händel wider die Lapithen widerrieth, jedoch aber, zu ihrem großen Nachtheile, kein Gehör fand. Ovid. Metam . XII. v. 308 ."
http://www.wikidata.org/entity/Q22132618,Atla,germanische Sagengestalt
http://www.wikidata.org/entity/Q56054779,Banvs,"BANVS , i, Gr . Βάνος, ου, einer von des Aktäons Hunden, welche ihn endlich zerrissen, als er von der Diana in einen Hirsch verwandelt worden. Anonymus ap. Apollod. lib. III. c. 4. §. 4 ."
http://www.wikidata.org/entity/Q866715,Bisterk Ding,Dämon
http://www.wikidata.org/entity/Q56102516,Borax,"BORAX , ăcis , einer von Aktäons vielen Hunden, welche endlich ihren Herrn selbst zerrissen und fraßen. Hyg. Fab. 181 . Sieh Actæon."
http://www.wikidata.org/entity/Q56102785,Bores,"BORES , æ, Gr . Βόρης, ου, ebenfalls einer von Aktäons Hunden, wo er nicht eben vorhergehender seyn soll. Poet. vetus ap. Apollod. lib. III. c. 4. §. ult ."
http://www.wikidata.org/entity/Q57380428,Chediaetros,"CHEDIAETROS , i , einer von Aktäons Hunden. Sieh Actæon ."
http://www.wikidata.org/entity/Q57521134,Cirrha,"CIRRHA , æ, Gr . Κίῤῥα, ας, eine Nymphe, von welcher die Stadt Cirrha in Phocis ihren Namen bekommen. Pausan. Phoc. c. 37. p. 684 ."
http://www.wikidata.org/entity/Q57759291,Cleis,"CLEIS , ĭdis , eine Nymphe, welcher Jupiter, mit ihren Schwestern, den jungen Bacchus, in der Insel Naxus, aufzuerziehen gab. Diod. Sic. L. V. c. 52. p. 225 ."
http://www.wikidata.org/entity/Q58641094,Coran,"CORAN , ánis , einer von Aktäons Hunden, welche endlich selbst ihren Herrn anfielen und zerrissen, als er von der Diana in einen Hirsch war verwandelt worden. Hygin. Fab. 181 ."
http://www.wikidata.org/entity/Q58840903,Crenaevs,"CRENAEVS , i , ( ⇒ Tab. XIV.) einer von den Centauren auf des Pirithous Beylager, welcher auszureißen suchte, als er sah, daß es zu sehr über sein Geschlecht hergieng. Indem er aber sich aufder Flucht noch einmal umsah, so warf ihn Dryas mi"
http://www.wikidata.org/entity/Q59208740,Cyllo,"CYLLO , us , einer von Aktäons Hunden, welche ihren Herrn selbst zerrissen, nachdem er von der Diana in einen Hirsch verwandelt worden. Hygin. Fab. 181 . Sieh Actæon ."
http://www.wikidata.org/entity/Q59208741,Cyllopotes,"CYLLOPOTES , æ , auch einer von Aktäons Hunden. Hygin. Fab. 181 . Sieh Actæon ."
http://www.wikidata.org/entity/Q59218690,Cyprivs,"CYPRIVS , i , einer von Aktäons vielen Hunden. Hygin. Fab. 181 . Sieh Actæon ."
http://www.wikidata.org/entity/Q1193140,Der Elfstier,mythischer Stier im irischen und schottischen Volksmärchen
http://www.wikidata.org/entity/Q59871455,Dicte,"DICTE , es , eine Nymphe, welche sich von einem Berge in Kreta ins Meer stürzete, als sie auf andere Art den Liebesverfolgungen des Minos nicht entgehen konnte, der aber hernach deren Tugend und Keuschheit bewunderte, und daher solchen Berg von ihr&"
http://www.wikidata.org/entity/Q11060107,Dijiang,chinesische Gottheit
http://www.wikidata.org/entity/Q60185624,Dorylas,"DORỸLAS , æ , ( ⇒ Tab. XIII.) ein Centaur, welcher auf des Pirithous Hochzeit mit dem Peleus zusammen gerieth, und solchem eins mit einem Paare ertappeter Ochsenhörner versetzen ch wollte. Indem aber dieser ihn mit dem Wurfspieße wid"
http://www.wikidata.org/entity/Q60193672,Draco,"DRACO , ónis , einer von Aktäons vielen Hunden, welche endlich diesen ihren eigenen Herrn, als er von der Diana war in einen Hirsch verwandelt worden, anfielen und zerrissen. Hygin. Fab. 181 ."
http://www.wikidata.org/entity/Q60194675,Dromas,"DROMAS , ădis , einer von den vielen Hunden des Aktäons. Ovid. Metam . III. v. 217. & Hygin. Fab. 181 ."
http://www.wikidata.org/entity/Q60194631,Dromivs,"DROMIVS , i , auch einer von Aktäons vielen Hunden, die ihren Herrn zerrissen. Hygin. Fab. 181 . sieh Actæon ."
http://www.wikidata.org/entity/Q60195974,Dryalvs,"DRYĂLVS , i, Gr . Δρύαλος, ου, des Peuceus Sohn, ein Centaur, welcher sich mit auf des Pirithous Hochzeit befand, und bey dem entstandenen Gefechte mit den Lapithen seine Person au"
http://www.wikidata.org/entity/Q60228094,Echnobas,"ECHNŎBAS , æ , einer von Aktäons vielen Hunden, dessen Namen aber nicht allzurichtig zu seyn scheint. Hygin. Fab. 181. ad eum Muncker. l. c . Sieh. Actæon ."
http://www.wikidata.org/entity/Q60240864,Egnatia,"EGNATIA , æ , war eine Nymphe, von der die Stadt Egnatia , in Apulien, ihren Namen hatte, woselbst sie auch göttlich verehret wurde. Und zwar hatte sie ihren Altar, auf welchem das Opferholz, wenn es geziemend geleget wurde, alsdenn von sich selbst"
http://www.wikidata.org/entity/Q1344559,Entenwick,Fabelwesen aus Sachsenheim in Baden-Württemberg
http://www.wikidata.org/entity/Q60465996,Eperie,"EPERIE , es , eine Nymphe, in welche sich Aesakus verliebete, die ihm aber immer aus dem Wege gieng. Sieh Aesacus ."
http://www.wikidata.org/entity/Q18060939,Erawan,thailändische Form des mythischen Elefanten Airavata
http://www.wikidata.org/entity/Q60619127,Erythrevs,"ERYTHREṼS , ei , eines von den vier Pferden der Sonne, welches so viel, als roth , heißt, weil die Sonne frühmorgens roth aufzugehen pflegt. Fulgent. Mythol. lib. I. c. 11 . Sieh Sol ."
http://www.wikidata.org/entity/Q1372114,Euboios,Gigant aus der griechischen Mythologie
http://www.wikidata.org/entity/Q15808782,Eunosta,Nymphe der Griechischen Mythologie
http://www.wikidata.org/entity/Q1374107,Euphorbos,Gigant aus der griechischen Mythologie
http://www.wikidata.org/entity/Q60691485,Evdromvs,"EVDRŎMVS , i , einer von Aktäons vielen Hunden. Hygin. Fab. 181 . Sieh Actæon ."
http://www.wikidata.org/entity/Q1545450,Greif,Bezeichnung eines Fabelwesens in der altägyptischen Mythologie
http://www.wikidata.org/entity/Q1566760,Habergeiß,Dämonengestalt alpenländischer Mythologie-Kultur
http://www.wikidata.org/entity/Q101363532,Hadburg,Meerweib im Nibelungenlied
http://www.wikidata.org/entity/Q1398720,Halios geron,griechische Gottheit
http://www.wikidata.org/entity/Q1575492,Hanghuhn,Fantasiewesen
http://www.wikidata.org/entity/Q62108371,Harpalos,"HARPALOS , i , einer von Aktäons vielen Hunden. Ovid. Metam . III. 222 . Er heißt so viel als Rapax . Cnipp. ad eumd. l. c . Sieh Actæon ."
http://www.wikidata.org/entity/Q65054738,Helimvs,"HELĬMVS , i , ( ⇒ Tab. XIV.) einer von den Centauren, der auf des Pirithous Hochzeit von dem Cäneus erleget wurde. Ovid. Metam . XII. v. 460 ."
http://www.wikidata.org/entity/Q53717274,Hija,Geistwesen der albanischen Mythologie
http://www.wikidata.org/entity/Q11488089,Kage-onna,Wesentlich des japanischen Volksglauben
http://www.wikidata.org/entity/Q1776640,Klushund,Sagengestalt aus dem österreichischen Bundesland Vorarlberg
http://www.wikidata.org/entity/Q22965484,Kornmann,deutsche Sagengestalt
http://www.wikidata.org/entity/Q1792788,Kuperan,Riese der Siegfried-Sage
http://www.wikidata.org/entity/Q107552580,Latreus,in der klassischen Mythologie ein Kentaur
http://www.wikidata.org/entity/Q1900292,Mo-O,mythisches Wesen
http://www.wikidata.org/entity/Q39618949,Morro,fiktive Figur aus Lego Ninjago
http://www.wikidata.org/entity/Q56462861,Muggestutz,Zwerg aus dem gleichnamigen Buch
http://www.wikidata.org/entity/Q2377658,Pihi,mythologischer Vogel
http://www.wikidata.org/entity/Q1656820,Popelmann,Sagengestalt
http://www.wikidata.org/entity/Q4901802,Roggenmuhme,deutsche Sagengestalt
http://www.wikidata.org/entity/Q30310171,Roggenwolf,wolfsgestaltiger Korndämon
http://www.wikidata.org/entity/Q53700542,Sakoko (Fabelwesen),Fabelwesen auf der südostasiatischen Insel Timor
http://www.wikidata.org/entity/Q9350419,Sirius,antiker Kult
http://www.wikidata.org/entity/Q2350271,Stinthengst,Fabelwesen
http://www.wikidata.org/entity/Q2404406,Tereine,Najade der Griechischen Mythologie
http://www.wikidata.org/entity/Q4661578,Aani,Wesen der altägyptischen Religion
http://www.wikidata.org/entity/Q304227,Aba,Najade der Griechischen Mythologie
http://www.wikidata.org/entity/Q276765,Abaddon,mythologische Figur der Bibel
http://www.wikidata.org/entity/Q279782,Abarbarea,Najade der Griechischen Mythologie
http://www.wikidata.org/entity/Q305548,Abarbarea,tyrische Najade der griechischen Mythologie
http://www.wikidata.org/entity/Q305611,Abas,Sohn des Ixion
http://www.wikidata.org/entity/Q322585,Abnoba,keltische Muttergöttin
http://www.wikidata.org/entity/Q21547755,Abrax,"ABRAX , ăcis , eines der Pferde, welche der Aurora Wagen ziehen sollen, Hygin. Fab. 183. welches andere aber lieber Labrax nennen. Muncker. ad Hygin. l. c ."
http://www.wikidata.org/entity/Q334749,Abu,sumerischer Vegetationsgott
http://www.wikidata.org/entity/Q4748,Abyzou,weiblicher Dämon
http://www.wikidata.org/entity/Q221574,Abzu,mesopotamischer Gott des unter der Erde befindlichen Süßwasserozeans
http://www.wikidata.org/entity/Q21547780,Achamas,"ACHĂMAS , æ , ( ⇒ Tab. II.) ein Cyklope und Vulcans Schmiedeknecht in Sicilien. Val. Flaccus Argonaut. lib. I. v. 580 ."
http://www.wikidata.org/entity/Q391379,Achelous,in der griechischen Mythologie die Personifikation des Flusses Acheloos
http://www.wikidata.org/entity/Q12626619,Acheron,mythischer Fluss
http://www.wikidata.org/entity/Q3615214,Achiroe,Najade
http://www.wikidata.org/entity/Q21547793,Acholoë,"ACHOLOË , es , ( ⇒ Tab. IV.) eine von den Harpyien, wovon die beyden anderen Aëllopus und Ocypete sollen geheißen haben, von andern aber auch mehrern Theiles anders genannt werden. Hygin. Fab. 14 ."
http://www.wikidata.org/entity/Q419156,Acis,Person der griechischen Mythologie
http://www.wikidata.org/entity/Q21547805,Acmónides,"ACMÓNIDES , æ , ( ⇒ Tab. II.) ein Cyklope und Vulcans Schmiedeknecht, in dem Berge Aetna , Ovid. Fast. IV. v. 288 . der den Namen von ἄκμων hat, welches einen Amboß bedeutet. Andere nennen dafür den Argen , Heins."
http://www.wikidata.org/entity/Q12873255,Acraea,Najade der griechischen Mythologie
http://www.wikidata.org/entity/Q12898582,Actaea,"ACTAEA , æ, Gr . Ἀκταίη, ης, ( ⇒ Tab. IIII.) des Nereus und der Doris Tochter, und mithin eine von den Nereiden, oder Meernymphen, Apollodor. lib. I. c. 3. §. 7. & Hygin. Præf. p. 6 . d"
http://www.wikidata.org/entity/Q21547851,Actaeon,"ACTAEON , ŏnis , eines von denen vier Pferden der Sonne, das aber besser Aethon genennet wird. Fulgent. Mythol. lib. I. c. 2. & ad eum Muncker. l. c ."
http://www.wikidata.org/entity/Q346547,Adad,mesopotamischer Wettergott
http://www.wikidata.org/entity/Q2718640,Adamanthea,"ADAMANTAE , æ , Jupiters Amme, welche ihn in der Wiege an einen Baum hieng, damit er weder im Himmel, noch auf der Erde, noch im Wasser möchte gefunden werden, und, damit er sich auch nicht durch sein Schreyen verriethe, so gab ..."
http://www.wikidata.org/entity/Q4682505,Adhene,mythische Figuren der Isle of Man
http://www.wikidata.org/entity/Q4679171,Admete,"ADMÉTE , es, Gr . Ἀδμήτη, ης, ( ⇒ Tab. III.) des Oceans und der Tethys Tochter, Hesiod. Theog. v. 349. welche von dem α privat . δαμάω, domo , so viel"
http://www.wikidata.org/entity/Q366515,Adramelech,Figur der christlichen Dämonologie
http://www.wikidata.org/entity/Q4057954,Adrasteia,Oceans Tochter
http://www.wikidata.org/entity/Q404396,Aegiale,Tochter des Helios
http://www.wikidata.org/entity/Q321298,Aegina,Najade der Griechischen Mythologie
http://www.wikidata.org/entity/Q26276980,Aegle,Najade der Griechischen Mythologie
http://www.wikidata.org/entity/Q21272183,Aegle,"Figur der griechischen Mythologie, Hesperide"
http://www.wikidata.org/entity/Q380832,Aello,griechische Mythologie
http://www.wikidata.org/entity/Q3605939,Aellopoda,"AELLŎPVS , ŏdis, Gr . Αἐλλόπους, οδος, ( ⇒ Tab. IV.) ebenfalls eine der Harpyien, welche den Phineus plageten, und da sie Zetes und Calais verf"
http://www.wikidata.org/entity/Q21548001,Aeon,"AEON , ónis , einer von Actäons vielen Hunden, welche ihren Herrn, da ihn Diana in einen Hirsch verwandelt hatte, selbst anfielen und zerrissen. Hygin. Fab. 181 ."
http://www.wikidata.org/entity/Q21548009,Aesepus,"AESÉPVS , Gr . Αἴσηπος, ου, ( ⇒ Tab. III.) des Oceans und der Thetys Sohn, Hesiod Theogon. v. 342 . war ein Fluß in klein Mysien, der unterhalb der Stadt Cyzicum in den Propont fällt. C"
http://www.wikidata.org/entity/Q21548011,Aesile,"AESILE , es , ( ⇒ Tab. VIII.) eine von des Atlas Töchtern, deren Schwestern Ambrosia , Eudora, Dione und Polyxo waren, die aber andere auch insgesammt anders nennen. Nat. Com. Mythol. lib. IV. c. 7 ."
http://www.wikidata.org/entity/Q21548022,Aethe,"AETHE , es, Gr . Αἴθη, ης, eines von des Agamemnons Pferden, die er mit vor Troja hatte. Hom. Iliad. Ψ. v. 299 ."
http://www.wikidata.org/entity/Q21548048,Aethiops,"AETHIOPS , ŏpis , eines von den Pferden der Sonne, welches so viel als das feurige bedeutet, und insonderheit die Früchte zu ihrer Reise bringen soll. Hygin. Fab. 183 ."
http://www.wikidata.org/entity/Q3606127,Aethon,Pferd des Aeolus in der griechischen Mythologie
http://www.wikidata.org/entity/Q1371462,Aethon,Adler der griechischen Mythologie
http://www.wikidata.org/entity/Q21548057,Aethon,"AETHON , ónis , das Leibpferd des Pallas , Prinzen des Evanders , welches seines Herrn Tod mit großen Thränen beweinete. Virgil. Aen. XI. v. 89 ."
http://www.wikidata.org/entity/Q21548051,Aethon,eines der Pferde des Gottes Helios nach Ovid
http://www.wikidata.org/entity/Q21548062,Aethon,"AETHON , onis , eines von den Pferden des Hektors. Hom. Il Θ. v. 185 ."
http://www.wikidata.org/entity/Q21548060,Aethon,"AETHON , ónis , eines von den Pferden der Morgenröthe. Serv. ad Virg. Aen. XI. v. 89. & Caud. Cons. IV. Hon. v. 561 ."
http://www.wikidata.org/entity/Q21548065,Aethon,"AETHON , ónis , eines von den vier Pferden des Pluto, wovon die andern Orphnäus, Nykteus und Alastor heißen. Claud. de Rapt. Proserp. lib. I. v. 282 ."
http://www.wikidata.org/entity/Q410531,Aethra,Okeanide der griechischen Mythologie
http://www.wikidata.org/entity/Q21548035,Aethíon,"AETHÍON , ŏnis , ein Pferd des Euneus, in dem Kriege vor Theben , das den Namen von αἴθω, ich brenne , hat, und daher so viel, als ein feuriges Roß bedeutet. Stat. Thebaid. VI. v. 465. & ad eum Barthius l. c ."
http://www.wikidata.org/entity/Q390448,Aganippe,Najade der Griechischen Mythologie
http://www.wikidata.org/entity/Q390597,Agares,Dämon
http://www.wikidata.org/entity/Q390815,Agasthenes,Gigant aus der griechischen Mythologie
http://www.wikidata.org/entity/Q381459,Agave,Person der griechischen Mythologie
http://www.wikidata.org/entity/Q391614,Agave,Nereide der griechischen Mythologie
http://www.wikidata.org/entity/Q394161,Aglaia,Gattin des Charopos
http://www.wikidata.org/entity/Q3361417,Aglaope,eine der Sirenen
http://www.wikidata.org/entity/Q21548117,Aglaophónos,"AGLAOPHÓNOS , i, Gr . Ἀγλαόφωνος, ου, ( ⇒ Tab. III.) eine von den Sirenen, wovon die andern Thelxiope und Molpe geheißen haben sollen. Chærilus ap. Natal. com. lib."
http://www.wikidata.org/entity/Q3606663,Agno,In der griechischen Mythologie die Nymphe einer arkadischen Quelle
http://www.wikidata.org/entity/Q21548147,Agre,"AGRE , es , einer von Aktäons Hunden, welche ihn endlich selbst, als er in einen Hirsch verwandelt worden, zerrissen und fraßen. Ovid. Metam . III. v. 212. & Hygin. Fab. 181 . Er soll von ἄγρα, die Jagd , den Namen haben"
http://www.wikidata.org/entity/Q21548159,Agriodus,"AGRIŎDOS , i , einer von des Aktäons vielen Hunden, welche ihn endlich, da er von der Diana in einen Hirsch verwandelt worden war, selbst zerrissen. Ovid. Metam . III. v. 224. & Hygin. Fab. 181 ."
http://www.wikidata.org/entity/Q518658,Agrius,Kentaur
http://www.wikidata.org/entity/Q14912115,Agrius,"Figur der griechischen Mythologie, Gigant"
http://www.wikidata.org/entity/Q4696456,Ahöla,Geistwesen  in der Hopi-Religion
http://www.wikidata.org/entity/Q21286569,Aigeiros,"Hamadryade, Tochter der Hamadryas und des Oxylos"
http://www.wikidata.org/entity/Q440861,Airaavatha,hinduistisches Reittier des Schöpfergottes Indra
http://www.wikidata.org/entity/Q5695424,Aix,Nymphe
http://www.wikidata.org/entity/Q547968,Akhkhazu,Dämon aus der sumerischen und akkadischen Mythologie
http://www.wikidata.org/entity/Q21548208,Alastor,"ALASTOR , ŏris , eines von den vier Pferden des Pluto, wovon die andern 3 Orphnäus, Aethon und Nycteus hießen. Claud. de Rapt. Proserp. lib. I. v. 286 ."
http://www.wikidata.org/entity/Q948021,Albert Quackmore,Butler von Dagobert Duck
http://www.wikidata.org/entity/Q21548232,Alce,"ALCE , es , einer von Aktäons Hunden, welche endlich ihren Herrn selber anfielen und zerrissen, nachdem ihn Diana in einen Hirsch verwandelt hatte. Hygin. Fab. 181. & Ovid. Metam . III. v. 217 . Den Namen hat er von ἀλκὴ"
http://www.wikidata.org/entity/Q763268,Alcyone,Plejade der griechischen Mythologie
http://www.wikidata.org/entity/Q653681,Alcyoneus,Gigant der griechischen Mythologie
http://www.wikidata.org/entity/Q2141167,Allocer,Großherzog der Unterwelt
http://www.wikidata.org/entity/Q4733856,Almo,Flussgott
http://www.wikidata.org/entity/Q74189894,Alopex,fiktive Figur aus Teenage Mutant Ninja Turtles
http://www.wikidata.org/entity/Q911084,Alpheus,in der griechischen Mythologie der Gott des durch Arkadien und Elis fließenden Flusses Alpheios
http://www.wikidata.org/entity/Q107785,Amalthea,Nymphe der Griechischen Mythologie
http://www.wikidata.org/entity/Q455210,Amarok,Name eines riesigen Wolfes aus der Mythologie der Inuit
http://www.wikidata.org/entity/Q21548410,Amarynthus,"AMARYNTHVS , i, Gr . Ἀμάρυνθος, ου, einer von des Aktäons Hunden, welche ihn endlich selbst zerrissen und fraßen, nachdem er in einen Hirsch war verwandelt worden. Apollod. lib."
http://www.wikidata.org/entity/Q12898684,Amatheia,"AMATHÉA , æ, Græc . Ἀμάθεια, ας, ( ⇒ Tab. III.) eine von des Nereus und der Doris 50 Töchtern, oder den so genannten Nereiden. Homer. Il. Σ v. 48. Sie wird lateinisch auch Amathi"
http://www.wikidata.org/entity/Q3613853,Ambrosia,Nymphe der Griechischen Mythologie
http://www.wikidata.org/entity/Q474474,Ampelos,"griechische Gottheit, Geliebter des Dionysos"
http://www.wikidata.org/entity/Q12748314,Ampelus,"Hamadryade, Tochter der Hamadryas und des Oxylos"
http://www.wikidata.org/entity/Q21452535,Amphinome,"Figur der griechischen Mythologie, Nereide"
http://www.wikidata.org/entity/Q21548518,Amphirrhöe,"AMPHIRRHÖE , es, Gr . Ἀμφιῤῥόη, ης, eine Nymphe, die, dem Namen nach, mit voriger einerley bedeutet. Gyrald. Syntagm. V. pag. 180 ."
http://www.wikidata.org/entity/Q12898698,Amphithoe,"AMPHITHÖE , es , ( ⇒ Tab. IV.) des Nereus und der Doris Tochter, eine von den 50 Meernymphen Hygin. Præf. p. 6 ."
http://www.wikidata.org/entity/Q180222,Amphitrite,Okeanide der griechischen Mythologie
http://www.wikidata.org/entity/Q4748435,Amphryssos,Fluss in Griechenland
http://www.wikidata.org/entity/Q4749481,Amycus,Kentaur der griechischen Mythologie
http://www.wikidata.org/entity/Q4749584,Amyrus,Flussgott der griechischen Mythologie
http://www.wikidata.org/entity/Q484278,Anahita,altiranische Gottheit
http://www.wikidata.org/entity/Q486110,Anapos,Flussgott der griechischen Mythologie
http://www.wikidata.org/entity/Q489104,Anchiale,Nymphe
http://www.wikidata.org/entity/Q3615218,Ancio,Kentaur
http://www.wikidata.org/entity/Q21548629,Andes,"ANDES , æ, Gr . Ἄνδης, ου, ( ⇒ Tab. II.) einer von des Cölus und der Erde Söhnen. Steph. Byz. in Ἄδανα ."
http://www.wikidata.org/entity/Q1782874,Andras,Dämon in der christlichen Mythologie
http://www.wikidata.org/entity/Q1465739,Angel of Death,Engel des Todes
http://www.wikidata.org/entity/Q21548672,Anonymvs,"ANONỸMVS , i, Græc . Ἀνώνυμος, ου, ein Riese, welcher mit seinem Helfer, dem Perlpnous, der Juno Gewalt anthun wollte, allein, darüber auch von dem Herkules erleget wurde. Ptol."
http://www.wikidata.org/entity/Q29686726,Anthracia,arkadische Nymphe
http://www.wikidata.org/entity/Q21548693,Anthédon,"ANTHÉDON , ŏnis, Gr . Ἀνθηδὼν, όνος, eine Nymphe, von welcher die Stadt Anthedon in Böotien den Namen bekommen haben soll. Pausan. Bœot. c. 22 ."
http://www.wikidata.org/entity/Q574828,Antianeira,Tochter des Pheres
http://www.wikidata.org/entity/Q21548750,Antimachus,"ANTIMĂCHVS , i , ( ⇒ Tab. XIV.) ein Centaurus, welchen Cäneus in dem Scharmützel auf des Pirithous Beylager nebst andern mit niedermachete. Ovid. Metam . lib. XII. v. 460 ."
http://www.wikidata.org/entity/Q47534,Anubis,Gottheit in der altägyptischen Mythologie
http://www.wikidata.org/entity/Q614030,Anytos,griechische Gottheit
http://www.wikidata.org/entity/Q615537,Aobh,weibliche Sagengestalt aus der keltischen Mythologie
http://www.wikidata.org/entity/Q21153021,Aora,Nymphe
http://www.wikidata.org/entity/Q26806435,Aphareus,Kentaurengestalt der griechischen Mythologie
http://www.wikidata.org/entity/Q28045772,Apheidas,Kentaur
http://www.wikidata.org/entity/Q2614157,Archon,antike Bezeichnung für böse Geister
http://www.wikidata.org/entity/Q8203830,Ardescus,Flussgott der griechischen Mythologie
http://www.wikidata.org/entity/Q643456,Arethusa,Nymphe einer Quelle auf der Insel Ortygia in Syrakus
http://www.wikidata.org/entity/Q644354,Argeia,Okeanide der griechischen Mythologie
http://www.wikidata.org/entity/Q15783910,Argius,Kentaur der griechischen Mythologie
http://www.wikidata.org/entity/Q519334,Argos,Jagdhund des Odysseus
http://www.wikidata.org/entity/Q55542316,Argus,"ARGVS, i, einer von den Hunden des Aktäons, die ihren Herrn anfielen [403] und zerrissen, als er von der Diana in einen Hirsch verwandelt worden. Apollod. lib. III. c. 4."
http://www.wikidata.org/entity/Q842435,Arion,Wunderpferd aus der griechischen Mythologie
http://www.wikidata.org/entity/Q55663885,Arsinoe,"ARSINOË , es , ( ⇒ Tab. VIII.) eine von den Hyaden, deren Schwestern Ambrosie, Bromie, Cisseïs und Koronis hießen. Hygin. Fab. 182 ."
http://www.wikidata.org/entity/Q4803671,Asbeel,gefallener Engel
http://www.wikidata.org/entity/Q55687991,Asbolus,"ASBŎLVS , i , einer von Aktäons Hunden, der von ἄσβολος, Ruß , den Namen hat, und schwarz gewesen seyn soll. Ovid. Metam . III. v. 218. & ad eum Cnipping. l. c ."
http://www.wikidata.org/entity/Q55777963,Ascus,"ASCVS , i, Gr . Ἀσκὸς, ου, ein Riese, welcher mit dem Lykurgus den Bacchus band, und in einen Fluß warf, den aber Mercurius wieder los machete, und dargegen dem Askus die Haut abzog, und einen Weinsch"
http://www.wikidata.org/entity/Q723668,Asena,legendäre Wölfin
http://www.wikidata.org/entity/Q907685,Ash,Gott in der Mythologie des Alten Ägypten
http://www.wikidata.org/entity/Q724824,Ashaqlun,ein manichäischer Dämon
http://www.wikidata.org/entity/Q605744,Asia,Okeanide der griechischen Mythologie
http://www.wikidata.org/entity/Q733322,Asmodeus,religiöse Figur
http://www.wikidata.org/entity/Q622781,Asopus,Flussgott zweier Flüsse
http://www.wikidata.org/entity/Q18642285,Asteria,"Titanide der griechischen Mythologie, Tochter des Koios"
http://www.wikidata.org/entity/Q748574,Asterodeia,Gattin des Aietes
http://www.wikidata.org/entity/Q250588,Astraeus,Titan der griechischen Mythologie
http://www.wikidata.org/entity/Q2868617,Astraios,Gigant aus der griechischen Mythologie
http://www.wikidata.org/entity/Q4812617,Atabey,Wassergottheit
http://www.wikidata.org/entity/Q221735,Atargatis,semitische Gottheit
http://www.wikidata.org/entity/Q3514860,Athis,Halbgott der Klassischen Mythologie
http://www.wikidata.org/entity/Q3626277,Atlantia,Hamadryade der griechischen Mythologie
http://www.wikidata.org/entity/Q130818,Atlas,Titan in der griechischen Mythologie
http://www.wikidata.org/entity/Q4816856,Atlas of Mauretania,König der griechischen Mythologie
http://www.wikidata.org/entity/Q774101,Aura,griechische Gottheit
http://www.wikidata.org/entity/Q931321,Axioche,Nymphe der Griechischen Mythologie
http://www.wikidata.org/entity/Q721135,Azazel,Dämon
http://www.wikidata.org/entity/Q16154505,Aziza,Wikimedia-Begriffsklärungsseite
http://www.wikidata.org/entity/Q490838,Azrael,einer der vier großen Engel im Islam
http://www.wikidata.org/entity/Q515882,Azure Dragon,Symbol der chinesischen Sternenkonstellation
http://www.wikidata.org/entity/Q590467,Baal,"im Altertum eine Bezeichnung für verschiedene Gottheiten im syrischen und levantinischen Raum; Titel, der für jeden Gott verwendet werden konnte, gewöhnlich der oberste Gott des örtlichen Pantheons"
http://www.wikidata.org/entity/Q187002,Baba Yaga,fiktive Figur
http://www.wikidata.org/entity/Q24652366,Badger Doctor,"Charakter aus Disneys ""Zoomania"""
http://www.wikidata.org/entity/Q794547,Bahamut,Fabelwesen
http://www.wikidata.org/entity/Q151761,Bahkauv,Sagengestalt aus Aachen
http://www.wikidata.org/entity/Q804542,Baku,japanisches Fabelwesen
